{
  "schema-version": 1,
  "generated-at": "2026-05-09T05:30:27.380Z",
  "source": "managed-via-manage-skill",
  "summary": {
    "total": 3,
    "active": 0,
    "open": 0,
    "planned": 0,
    "in-progress": 0,
    "blocked": 0,
    "deferred": 0,
    "implemented": 1,
    "cancelled": 2,
    "critical": 0,
    "high": 3,
    "normal": 0,
    "now": 0,
    "next": 3,
    "later": 0
  },
  "entries": [
    {
      "opportunity-id": "20260509-we-need-a-reliability-governance-domain-for-slo-",
      "summary": "we need a reliability-governance domain for SLO, incident, recovery, and availability tradeoff decisions across the bundle",
      "suggested-kind": "domain",
      "priority": "high",
      "status": "implemented",
      "horizon": "next",
      "adjacent-skills": [
        "architecture",
        "architecture-decision"
      ],
      "rationale": [
        "availability-tradeoffs",
        "incident-recovery",
        "slo"
      ],
      "recorded-at": "2026-05-09T07:39:57.117Z",
      "resolved-at": "2026-05-09T08:56:01.748Z",
      "created-skill": "reliability-governance",
      "admission-request-id": "20260509-we-need-a-reliability-governance-domain-for-slo-",
      "note": "implemented via create reliability-governance"
    },
    {
      "opportunity-id": "20260509-we-need-a-deterministic-route-regression-tool-th",
      "summary": "we need a deterministic route regression tool that compares route fixture precision across releases and emits a structured drift report",
      "suggested-kind": "tool",
      "priority": "high",
      "status": "cancelled",
      "horizon": "next",
      "adjacent-skills": [
        "bugfix",
        "verify-skill-system"
      ],
      "rationale": [
        "fixture-drift",
        "release-comparison",
        "route-regression"
      ],
      "recorded-at": "2026-05-09T07:38:42.081Z",
      "resolved-at": "2026-05-09T07:39:00.265Z",
      "admission-request-id": "20260509-we-need-a-deterministic-route-regression-tool-th",
      "note": "resolved by upgrading existing skill 'bugfix' via admission request '20260509-we-need-a-deterministic-route-regression-tool-th'"
    },
    {
      "opportunity-id": "20260509-we-need-a-pack-governance-domain-for-bundle-laye",
      "summary": "we need a pack-governance domain for bundle layering, portability boundaries, and distribution policy decisions across packs",
      "suggested-kind": "domain",
      "priority": "high",
      "status": "cancelled",
      "horizon": "next",
      "adjacent-skills": [
        "architecture",
        "skill-evolution"
      ],
      "rationale": [
        "distribution-policy",
        "pack-layering",
        "portability"
      ],
      "recorded-at": "2026-05-09T07:38:16.348Z",
      "resolved-at": "2026-05-09T07:38:24.616Z",
      "admission-request-id": "20260509-we-need-a-pack-governance-domain-for-bundle-laye",
      "note": "resolved by upgrading existing skill 'skill-evolution' via admission request '20260509-we-need-a-pack-governance-domain-for-bundle-laye'"
    }
  ]
}
